Article_ID,Category,Title,Title_link,Image,Date,Summary,Content,Field1
308,Education,"Schools Are Opening Worldwide, Providing a Model for the U.S.",https://www.edutopia.org/article/schools-are-opening-worldwide-providing-model-us,"https://wpvip.edutopia.org/wp-content/uploads/2022/10/Getty-1211656925.jpg?resize=220,150.92000000000002&quality=85","May 8, 2020",Children are returning to school in countries that are weeks—or months—ahead of the U.S. in battling Covid-19. Here’s how it’s happening.,"Yesterday, the Centers for Disease Control and Prevention (CDC) released a report setting out guidelines for opening child-care programs, day camps, and K-12 schools—or the report leaked, depending on who you read. 

The guidelines break school reopening into three phases—each with incrementally more relaxed rules, if infection rates are sufficiently low—but the big picture provides some good news: the recommendations reveal a path forward for schools to reopen, albeit with restrictions. 

High-touch surfaces, toys, drinking fountains, and school buses should be cleaned frequently, the CDC says; playgrounds and cafeterias should be closed or used in staggered shifts; field trips should be canceled; health screenings and body temperature checks for adults and students upon arrival should be considered; cloth masks should be mandatory for staff; and good air circulation throughout the school should be a priority. If someone in the building is later confirmed to be sick with Covid-19, the CDC writes, you might consider closing the school for one or two days to allow for cleaning. Already a few U.S. states with low case and fatality rates—Montana, Idaho, and Wyoming—have quietly announced reopening dates for some schools or school populations this year (students with IEPs, for example), though final decisions in Montana, for example, are left up to the local districts. Most of the country’s K-12 schools will remain closed until at least the fall. In parts of Western Europe and Asia, though, where Covid-19 touched down weeks, and in some cases months, earlier than in the U.S., the threat from the virus has gradually diminished—and schools have reopened to welcome students and teachers into classrooms. Reports from major news publications indicate that even with the strict new rules, children and teachers are generally happy to be back, but the reopenings have not been without controversy: In Denmark, some parents have protested, reported Patrick Kinsgley for The New York Times, and in Tel Aviv some teachers have pushed back over health and safety concerns, wrote Steve Hendrix in The Washington Post. A recent article by Business Insider’s Emily Cavanagh peeked inside the equivalent of K-12 schools operating around the world, from Taiwan to Denmark, China, Norway, and Israel, and looked at the common safety precautions in place. We also looked at recent coverage from The Washington Post, the Los Angeles Times, CNN, NBC, and The New York Times to get a better picture of the state of schools internationally. We’ve been hearing about staggered start times, or alternate day attendance, ever since California Gov. Gavin Newsom broached the topic in mid-April, as reported in the Los Angeles Times.

In Israel, as some schools began to open as the country’s infection rate declined, staggering arrival times has reduced the crowding that often occurs as buildings open, The Washington Post’s Hendrix reported. Other schools are increasing the number of school entry points to cut down on congestion. 

Meanwhile, in Denmark, where many schools have been open since mid-April—it was “the first country in the Western world to reopen its elementary schools since the start of the coronavirus pandemic,” according to The New York Times’s Kingsley—there’s another big change: Parents aren’t allowed in the building. Teachers, students, and parents are subject to temperature scans at the door—and in some countries, several times throughout the day—often from temperature guns that measure heat coming off the body, though there are concerns about the reliability of these devices outside carefully controlled health-care settings. The CDC guidelines recommend that schools develop protocols for isolating and transporting potentially sick adults or students: Schools should “identify an area to separate anyone who exhibits Covid-like symptoms” and set up “procedures for safely transporting anyone sick home or to a health-care facility.” In Shanghai, special isolation rooms have been set aside to separate people suspected of having the virus from everyone else, according to Business Insider’s Cavanagh. Protecting the vulnerable is crucial. In Israel, teachers and other school staff over the age of 65, and anyone with underlying health concerns, are encouraged to stay home, The Washington Post’s Hendrix reported. The CDC mirrors this guidance: “Protect and support staff and students who are at higher risk for severe illness, such as providing options for telework and virtual learning.” Social distancing throughout school is being enforced: In Denmark, Israel, and Norway, desks “are spaced six feet apart, which is the official recommendation for effective social distancing,” noted Cavanagh. Playgrounds, gym classes, school libraries, and even teachers’ lounges are closed in some countries.

Communal lunches are barred, in most cases, which is consistent with CDC guidelines: “If a cafeteria or group dining room is typically used, serve meals in classrooms instead. Serve individually plated meals.” In some schools, students are assigned seats in the cafeteria, which are arranged three feet apart. Buffet-style grazing is out; food is often plated and served individually, to reduce the obvious channels of transmission.

Small groups of students are often kept together for the whole day—social mixing is discouraged—and are sequestered in a single classroom to avoid congregating in hallways. In Denmark, many classes are conducted outdoors or in outdoor tents, where social distancing measures are easier to accommodate, according to CNN, NBC, and others. Many, though not all, schools require masks for adults and students, and hand washing and sanitizing are frequent. “In Denmark, schools have installed handwashing stations outside of the buildings and students have to wash their hands at least once an hour,” Cavanagh writes, while in Norway classrooms, toys, and frequently touched surfaces are now sanitized twice daily. In another safety measure, notes Kingsley about Danish schools: “Tea ladies have the new task of touring the school with disinfectant, cleaning each door handle at least twice during school hours.”

Contributing editor Sarah Gonser provided additional reporting for this article."," High-touch surfaces, toys, drinking fountains, and school buses should be cleaned frequently, the CDC says; playgrounds and cafeterias should be closed or used in staggered shifts; field trips should be canceled; health screenings and body temperature checks for adults and students upon arrival should be considered; cloth masks should be mandatory for staff; and good air circulation throughout the school should be a priority. Reports from major news publications indicate that even with the strict new rules, children and teachers are generally happy to be back, but the reopenings have not been without controversy: In Denmark, some parents have protested, reported Patrick Kinsgley for The New York Times, and in Tel Aviv some teachers have pushed back over health and safety concerns, wrote Steve Hendrix in The Washington Post."
309,Education,The 10 Most Significant Education Studies of 2020,https://www.edutopia.org/article/10-most-significant-education-studies-2020,"https://wpvip.edutopia.org/wp-content/uploads/2022/10/a3175ir1035crop.jpg?resize=220,150.92000000000002&quality=85","December 4, 2020",We reviewed hundreds of educational studies in 2020 and then highlighted 10 of the most significant—covering topics from virtual learning to the reading wars and the decline of standardized tests.,"In the month of March of 2020, the year suddenly became a whirlwind. With a pandemic disrupting life across the entire globe, teachers scrambled to transform their physical classrooms into virtual—or even hybrid—ones, and researchers slowly began to collect insights into what works, and what doesn’t, in online learning environments around the world. Meanwhile, neuroscientists made a convincing case for keeping handwriting in schools, and after the closure of several coal-fired power plants in Chicago, researchers reported a drop in pediatric emergency room visits and fewer absences in schools, reminding us that questions of educational equity do not begin and end at the schoolhouse door. When students are learning a new language, ask them to act out vocabulary words. It’s fun to unleash a child’s inner thespian, of course, but a 2020 study concluded that it also nearly doubles their ability to remember the words months later. Researchers asked 8-year-old students to listen to words in another language and then use their hands and bodies to mimic the words—spreading their arms and pretending to fly, for example, when learning the German word flugzeug, which means “airplane.” After two months, these young actors were a remarkable 73 percent more likely to remember the new words than students who had listened without accompanying gestures. Researchers discovered similar, if slightly less dramatic, results when students looked at pictures while listening to the corresponding vocabulary.  It’s a simple reminder that if you want students to remember something, encourage them to learn it in a variety of ways—by drawing it, acting it out, or pairing it with relevant images, for example. Get our new newsletter, The Research Is In—a monthly roundup of the most impactful education research, translated into actionable classroom strategies. For most kids, typing just doesn’t cut it. In 2012, brain scans of preliterate children revealed crucial reading circuitry flickering to life when kids hand-printed letters and then tried to read them. The effect largely disappeared when the letters were typed or traced. More recently, in 2020, a team of researchers studied older children—seventh graders—while they handwrote, drew, and typed words, and concluded that handwriting and drawing produced telltale neural tracings indicative of deeper learning. “Whenever self-generated movements are included as a learning strategy, more of the brain gets stimulated,” the researchers explain, before echoing the 2012 study: “It also appears that the movements related to keyboard typing do not activate these networks the same way that drawing and handwriting do.” It would be a mistake to replace typing with handwriting, though. All kids need to develop digital skills, and there’s evidence that technology helps children with dyslexia to overcome obstacles like note taking or illegible handwriting, ultimately freeing them to “use their time for all the things in which they are gifted,” says the Yale Center for Dyslexia and Creativity. A 2020 study found that ACT test scores, which are often a key factor in college admissions, showed a weak—or even negative—relationship when it came to predicting how successful students would be in college. “There is little evidence that students will have more college success if they work to improve their ACT score,” the researchers explain, and students with very high ACT scores—but indifferent high school grades—often flamed out in college, overmatched by the rigors of a university’s academic schedule. Just last year, the SAT—cousin to the ACT—had a similarly dubious public showing. In a major 2019 study of nearly 50,000 students led by researcher Brian Galla, and including Angela Duckworth, researchers found that high school grades were stronger predictors of four-year-college graduation than SAT scores. The reason? Four-year high school grades, the researchers asserted, are a better indicator of crucial skills like perseverance, time management, and the ability to avoid distractions. It’s most likely those skills, in the end, that keep kids in college. A simple step might help undercut the pernicious effect of grading bias, a new study found: Articulate your standards clearly before you begin grading, and refer to the standards regularly during the assessment process. In 2020, more than 1,500 teachers were recruited and asked to grade a writing sample from a fictional second-grade student. All of the sample stories were identical—but in one set, the student mentions a family member named Dashawn, while the other set references a sibling named Connor. Teachers were 13 percent more likely to give the Connor papers a passing grade, revealing the invisible advantages that many students unknowingly benefit from. When grading criteria are vague, implicit stereotypes can insidiously “fill in the blanks,” explains the study’s author. But when teachers have an explicit set of criteria to evaluate the writing—asking whether the student “provides a well-elaborated recount of an event,” for example—the difference in grades is nearly eliminated. When three coal-fired plants closed in the Chicago area, student absences in nearby schools dropped by 7 percent, a change largely driven by fewer emergency room visits for asthma-related problems. The stunning finding, published in a 2020 study from Duke and Penn State, underscores the role that often-overlooked environmental factors—like air quality, neighborhood crime, and noise pollution—have in keeping our children healthy and ready to learn. At scale, the opportunity cost is staggering: About 2.3 million children in the United States still attend a public elementary or middle school located within 10 kilometers of a coal-fired plant. The study builds on a growing body of research that reminds us that questions of educational equity do not begin and end at the schoolhouse door. What we call an achievement gap is often an equity gap, one that “takes root in the earliest years of children’s lives,” according to a 2017 study. We won’t have equal opportunity in our schools, the researchers admonish, until we are diligent about confronting inequality in our cities, our neighborhoods—and ultimately our own backyards. Some of the most popular study strategies—highlighting passages, rereading notes, and underlining key sentences—are also among the least effective. A 2020 study highlighted a powerful alternative: Get students to generate questions about their learning, and gradually press them to ask more probing questions. In the study, students who studied a topic and then generated their own questions scored an average of 14 percentage points higher on a test than students who used passive strategies like studying their notes and rereading classroom material. Creating questions, the researchers found, not only encouraged students to think more deeply about the topic but also strengthened their ability to remember what they were studying. There are many engaging ways to have students create highly productive questions: When creating a test, you can ask students to submit their own questions, or you can use the Jeopardy! game as a platform for student-created questions. One of the most widely used reading programs was dealt a severe blow when a panel of reading experts concluded that it “would be unlikely to lead to literacy success for all of America’s public schoolchildren.” In the 2020 study, the experts found that the controversial program—called “Units of Study” and developed over the course of four decades by Lucy Calkins at the Teachers College Reading and Writing Project—failed to explicitly and systematically teach young readers how to decode and encode written words, and was thus “in direct opposition to an enormous body of settled research.” The study sounded the death knell for practices that de-emphasize phonics in favor of having children use multiple sources of information—like story events or illustrations—to predict the meaning of unfamiliar words, an approach often associated with “balanced literacy.” In an internal memo obtained by publisher APM, Calkins seemed to concede the point, writing that “aspects of balanced literacy need some ‘rebalancing.’” In 2020, a team at Georgia State University compiled a report on virtual learning best practices. While evidence in the field is ""sparse"" and ""inconsistent,"" the report noted that logistical issues like accessing materials—and not content-specific problems like failures of comprehension—were often among the most significant obstacles to online learning. It wasn’t that students didn’t understand photosynthesis in a virtual setting, in other words—it was that they didn’t find (or simply didn't access) the lesson on photosynthesis at all. That basic insight echoed a 2019 study that highlighted the crucial need to organize virtual classrooms even more intentionally than physical ones. Remote teachers should use a single, dedicated hub for important documents like assignments; simplify communications and reminders by using one channel like email or text; and reduce visual clutter like hard-to-read fonts and unnecessary decorations throughout their virtual spaces. Because the tools are new to everyone, regular feedback on topics like accessibility and ease of use is crucial. Teachers should post simple surveys asking questions like “Have you encountered any technical issues?” and “Can you easily locate your assignments?” to ensure that students experience a smooth-running virtual learning space. Learning how to code more closely resembles learning a language such as Chinese or Spanish than learning math, a 2020 study found—upending the conventional wisdom about what makes a good programmer. In the study, young adults with no programming experience were asked to learn Python, a popular programming language; they then took a series of tests assessing their problem-solving, math, and language skills. The researchers discovered that mathematical skill accounted for only 2 percent of a person’s ability to learn how to code, while language skills were almost nine times more predictive, accounting for 17 percent of learning ability. That’s an important insight because all too often, programming classes require that students pass advanced math courses—a hurdle that needlessly excludes students with untapped promise, the researchers claim. “Content is comprehension,” declared a 2020 Fordham Institute study, sounding a note of defiance as it staked out a position in the ongoing debate over the teaching of intrinsic reading skills versus the teaching of content knowledge. While elementary students spend an enormous amount of time working on skills like “finding the main idea” and “summarizing”—tasks born of the belief that reading is a discrete and trainable ability that transfers seamlessly across content areas—these young readers aren’t experiencing “the additional reading gains that well-intentioned educators hoped for,” the study concluded. So what works? The researchers looked at data from more than 18,000 K–5 students, focusing on the time spent in subject areas like math, social studies, and ELA, and found that “social studies is the only subject with a clear, positive, and statistically significant effect on reading improvement.” In effect, exposing kids to rich content in civics, history, and law appeared to teach reading more effectively than our current methods of teaching reading.

Perhaps defiance is no longer needed: Fordham’s conclusions are rapidly becoming conventional wisdom—and they extend beyond the limited claim of reading social studies texts. According to Natalie Wexler, the author of the well-received 2019 book The Knowledge Gap, content knowledge and reading are intertwined. “Students with more [background] knowledge have a better chance of understanding whatever text they encounter. They’re able to retrieve more information about the topic from long-term memory, leaving more space in working memory for comprehension,” she recently told Edutopia."," Researchers asked 8-year-old students to listen to words in another language and then use their hands and bodies to mimic the words—spreading their arms and pretending to fly, for example, when learning the German word flugzeug, which means “airplane.” After two months, these young actors were a remarkable 73 percent more likely to remember the new words than students who had listened without accompanying gestures. “Whenever self-generated movements are included as a learning strategy, more of the brain gets stimulated,” the researchers explain, before echoing the 2012 study: “It also appears that the movements related to keyboard typing do not activate these networks the same way that drawing and handwriting do.” It would be a mistake to replace typing with handwriting, though."
