Article_ID,Title,Title_link,Image,Date,Summary,Content,Field1
500,‘Choosing the lesser evil’: Congress allies defend its Udhampur-Doda choice,https://indianexpress.com/article/political-pulse/choosing-lesser-evil-congress-allies-defend-udhampur-doda-choice-9264764/,"https://images.indianexpress.com/2024/04/choudhary-lal-singh-pulse.jpg?resize=450,253","APRIL 12, 2024","In 2018, Choudhary Lal Singh had to step down as minister after he continued to publicly back the Kathua gang rape and murder accused; while NC is now even attending his rallies, PDP says it is 'not supporting Lal Singh, but idea of India'","WITH THE CONGRESS having fielded the controversial Choudhary Lal Singh, who had publicly supported the accused in the 2018 gang rape and murder of a minor Bakerwal girl in Kathua, from Udhampur-Doda, its allies have been forced to go back on their criticism of him. The Congress, which had demanded stern action against the Kathua accused at the time, reinducted Lal Singh into its fold last month before giving him a ticket from Udhampur, a seat Lal Singh has won in the past. The party apparently wavered over the issue, finally giving in as it could not find any other winnable candidate. The Peoples Democratic Party (PDP), whose president Mehbooba Mufti as the chief minister in 2018 had got her then ally BJP to drop Lal Singh from her Cabinet over his stance in the case, is campaigning for him now. The same goes for the National Conference (NC), whose leader Omar Abdullah only last year opposed Lal Singh’s bid to join Rahul Gandhi’s Bharat Jodo Yatra in its J&K leg, warning the Congress that some people might try to use the Yatra to “whitewash their past”. “We have not forgotten the role played by those leaders who tried to save the (Kathua) rapists,’’ Omar had then told reporters. Asked about the Congress fielding Lal Singh now, NC spokesperson Imran Dar said, “It is the Congress’s decision… Our stand is very clear. Like the Congress cannot dictate to us whom to field, we cannot question their candidate selection.’’ Dar added: “There are two evils and we have to choose the lesser evil for a bigger fight now. At present, we have to defeat the BJP.” PDP spokesperson Firdous Tak also argued the same: “We have to see a larger and a broader objective at the moment… We are not supporting Lal Singh, but the idea of India, which we believe is the core ideology of the Congress and INDIA bloc.’’ However, while senior NC leaders, including ex-ministers, have been sharing the dais with Lal Singh, their PDP counterparts are staying away. “Only our junior leaders and ground-level workers are attending Lal Singh’s rallies,’’ a senior PDP leader said, admitting that the party is uncomfortable about “supporting the very person whom it had ousted from the Cabinet”. He added: “Mehbooba Mufti has made it clear to the Congress high command that she will not share the stage, or seek votes for him directly during the elections.” Asked about the Congress fielding a man whom the party had once criticised, J&K Congress chief spokesperson Ravinder Sharma argued back: “It is for the BJP to clarify, as he (Lal Singh) along with one of its other ministers, Chander Parkash Ganga, went there (to the rally held by the kin of the accused) on its instructions.” Sharma added: “Our stand was very clear. We wanted justice for the victim, and we did not politicise the issue… When the BJP found itself trapped in the matter, it sacrificed him (Lal Singh) to save its coalition government.” Deepika Pushkar Nath, who had quit the Congress over its invite to Lal Singh to join Rahul’s Yatra, and who represented the Kathua victim as an advocate, accused J&K leaders of hypocrisy and double-standards. The Democratic Progressive Azad Party (DPAP) of Ghulam Nabi Azad-led also criticised the Congress move as reflective of its “hypocrisy and fear of losing elections”. Its spokesperson Salman Nizami said Omar too was “betraying frustration in view of the NC’s shrinking base”. “The DPAP was the first to name G M Saroori as its Udhampur nominee soon after the BJP announced the candidature of (Union Minister of State) Jitendra Singh,” Nizami said, arguing that the “DPAP is the only party fighting the BJP in J&K”. “The NC and PDP have joined hands with the Congress only to weaken and target Azad,” he said. Jitendra Singh has won the past two times from Udhampur. Originally belonging to the Congress, Lal Singh had defected to the BJP ahead of the 2014 Assembly polls and, on winning, was inducted as a minister in the PDP-BJP coalition government. He had to step down after publicly supporting the Kathua accused. Lal Singh had gone on to hold ‘Tiranga’ rallies attacking “Kashmiri politicians” including Mehbooba, accusing them of using the Crime Branch to “frame” the accused as part of “a conspiracy against Jammu”. He had also quit the BJP to set up a Dogra Swabhiman Sangathan, alleging discrimination against Dogras and advocating a separate Jammu state. In the 2019 Lok Sabha polls, Lal Singh had contested simultaneously from Jammu and Udhampur, but got less than 20,000 votes in each, losing his security deposit. Even the voters in the panchyat to which the accused belong did not support Lal Singh.    "," The same goes for the National Conference (NC), whose leader Omar Abdullah only last year opposed Lal Singh’s bid to join Rahul Gandhi’s Bharat Jodo Yatra in its J&K leg, warning the Congress that some people might try to use the Yatra to “whitewash their past”. At present, we have to defeat the BJP.” PDP spokesperson Firdous Tak also argued the same: “We have to see a larger and a broader objective at the moment… We are not supporting Lal Singh, but the idea of India, which we believe is the core ideology of the Congress and INDIA bloc.’’ However, while senior NC leaders, including ex-ministers, have been sharing the dais with Lal Singh, their PDP counterparts are staying away."
501,"In seat facing Lanka, highlight is OPS’s fight, not Sethusamudram or Katchatheevu",https://indianexpress.com/article/political-pulse/ops-sri-lanka-sethusamudram-kathcatheevu-9264645/,"https://images.indianexpress.com/2024/04/ops.jpg?resize=450,253","APRIL 12, 2024","The former CM expelled from AIADMK and now in BJP camp is fighting from a relatively new territory, facing lingering anger over his “rebellion”","LOCATED deep in southern Tamil Nadu, a state where it is just beginning to make an impact, Ramanathapuram has long been on the BJP’s radar. Under the UPA government at the Centre, it waged a battle against the Sethusamudram project to create a shipping route between India and Sri Lanka, whose one end would have touched Ramanathapuram, claiming it would destroy the bridge Lord Ram’s army made as per the Ramayana. Last year, a buzz began that Prime Minister Narendra Modi, whose government has been making extensive outreach to Tamils, would contest from Ramanathapuram. Once the Lok Sabha poll battle began, the BJP rolled out yet another dice – accusing the Indira Gandhi-led Congress government of giving away Katchatheevu island located 33 km off the Ramanathapuram coast, and the ruling DMK (which was also in power in the state then) of being complicit in the decision. In the Ramanathapuram constituency itself, which directly faces Sri Lanka, none of the above is an issue, despite it being a fishermen constituency. The most distinctive feature of the fight here is the candidature of O Panneerselvam or OPS, the man who has become the face of the transformation the AIADMK has undergone since J Jayalalithaa’s demise in December 2016, much of it seen as wrought by the BJP. Having lost successive battles for control of the AIADMK – at party fora, and in courts – OPS has been forced to take shelter in the BJP-led alliance, after the AIADMK parted ways with it. The ex-CM is now contesting as an Independent, with BJP support. Now making perhaps his last stand, in a seat that was won in 2019 by DMK ally IUML, and where the party remains strong, the 73-year-old is campaigning late into the evening, trying to cover as much ground as he can. Close to midnight on Tuesday, driving down in a convoy from a campaign meeting at a small village near Ramanathapuram town, OPS remains unflagging – at least in his desire to wrest back the AIADMK. No, there is no regret about rebelling against the official faction led by E Palaniswami. Or any desire to “time travel” and change the sequence of events leading to his expulsion from the party, in which he had spent more than 45 years. “Why should I want to time travel?” OPS retorts. “All my steps were to retrieve the party from certain people, and hand it to ordinary AIADMK cadres.” It is hard not to take OPS’s words with a pinch of salt. “The certain people” he talks about are Jayalalithaa’s confidante V K Sasikala and her nephew T T V Dhinakaran – now also expelled from the AIADMK and part of the BJP camp, like OPS. OPS, in fact, has agreed to let Dhinakaran contest the Theni seat, which had been won by OPS’s son O P Ravindranath Kumar in 2019 (the only constituency not won by the DMK-led alliance then). Ravindranath is now actively working for Dhinakaran in Theni, OPS’s native town. On the other hand, Ramanathapuram, from where OPS is contesting, is relatively new ground for him. He has taken on the risk despite already being a sitting MLA. Aides say the BJP kept him waiting till the last minute on assurance of support, as it probed the scope of a patch-up with the AIADMK. OPS’s biggest hope is that the Thevars, the OBC community to which he belongs and which is dominant here, will stand by him. The DMK alliance has refielded the IUML’s 2019 winner, K Navas Kani. The AIADMK’s P Jeyaperumal and Naam Tamilar Katchi’s Chandraprabha are also in the fray. Denying reports that he was forced to give up Theni, OPS says it was he who picked Ramanathapuram “because it is the place where Lord Ram built the bridge across the ocean to rescue Sita Devi”. The fact that the BJP has been making slow gains here would have been another factor. If in the 2009 Lok Sabha elections, it got 16.5% of the votes, by 2014, it was up to 17.20%. In 2019, the BJP-AIADMK together got 32.31% votes. While the winner in 2014 was the AIADMK, with 40.81% of the votes, and the runner-up the DMK with 28.81% votes, in 2019, DMK ally IUML got 44.29% of the votes and the AIADMK-BJP alliance was second placed. The IUML 2019 win was not a fluke given Ramanathapuram’s significant minority population, another reason that the BJP has treaded here on the back of allies. This time, if the DMK has the IUML with it, the AIADMK has the PFI political wing SDPI (Social Democratic Party of India) as an ally. OPS says he is confident that Muslims too would vote for him seeing the Modi government’s record. “No minority community has been targeted under Modi. Everyone is treated equally,” he says. While OPS admits he hasn’t had any detailed interaction with Modi since the poll dates were announced, he claims “respect” for him since 2016. “Everyone respects him, and it is certain that he will be elected for a third time.” Returning to Palaniswami and why he thinks the AIADMK is no longer the party it was, OPS says: “When MGR started the party, it had bylaws, and the most important was the direct election of the party general secretary by the crores of cadres. That has been sabotaged by Palaniswami.” He denies that his description of Palaniswami as “dictatorial, undemocratic” has long held true for the AIADMK. “Amma (Jayalalithaa) was very democratic. Everything she did was in consultation with people like me, officers and experts… not like Palaniswami,” OPS says. However, not all believe OPS’s portrayal of himself as a victim of the internecine AIADMK fight. Many see him as the man who betrayed the AIADMK soon after Jayalalithaa’s demise, particularly as he was officiating as the CM at the time on her behalf (as he had done earlier as well). Within the BJP alliance too, some are not happy with the ticket to him and, on condition of anonymity, admit to working to defeat him. “OPS was the man who triggered a revolt within the AIADMK without leaving the party. The people don’t accept this, even if they forgive leaders jumping ship,” says a Madurai-based leader of the Tamil Maanila Congress, which is also a part of the NDA. This is why other AIADMK rebels such as Dhinakaran (Theni) and Nainar Nagendran (Tirunelveli) are viewed more favourably. Many point out that while Nagendran quit the AIADMK back in 2017, Dhinakaran had fought a long and hard battle against the BJP. It has been difficult for OPS to shake off the impression that he acted as an RSS stooge in fomenting rebellion within the AIADMK. In 2019, senior RSS ideologue S Gurumurthy claimed at the golden jubilee function of the Tughlak magazine that it was on his advice that OPS had rebelled against Sasikala, who saw herself as the natural successor to Jayalalithaa.    "," Once the Lok Sabha poll battle began, the BJP rolled out yet another dice – accusing the Indira Gandhi-led Congress government of giving away Katchatheevu island located 33 km off the Ramanathapuram coast, and the ruling DMK (which was also in power in the state then) of being complicit in the decision. The most distinctive feature of the fight here is the candidature of O Panneerselvam or OPS, the man who has become the face of the transformation the AIADMK has undergone since J Jayalalithaa’s demise in December 2016, much of it seen as wrought by the BJP. Having lost successive battles for control of the AIADMK – at party fora, and in courts – OPS has been forced to take shelter in the BJP-led alliance, after the AIADMK parted ways with it."
502,"‘BJP gets votes only due to Modi, and this time there is no Modi wave’: Congress Bastar candidate",https://indianexpress.com/article/political-pulse/lok-sabha-polls-congress-bastar-candidate-kawasi-lakhma-interview-9264411/,"https://images.indianexpress.com/2024/04/Bastar.jpg?resize=450,253","APRIL 12, 2024","Kawasi Lakhma accuses the BJP govt in state of killing Naxals and tribals indiscriminately, frittering away gains of Cong govt's policy of ""vishwas, vikas and suraksha""","After the shock loss in the Assembly elections, the Congress is looking to revive its electoral fortunes in Chhattisgarh in the Lok Sabha polls. It is also hoping to better its 2019 performance, when the party won just 2 of the 11 seats in the state. One of those two seats was Bastar, from where the Congress has fielded its six-term MLA Kawasi Lakhma this time, and which votes on April 19. He speaks to The Indian Express on the upcoming election, the poll issues, and rights of tribals, among other things. Firstly, there is no railway line connecting Bastar with Raipur. There should be two – one connecting the seven districts which the Lok Sabha seat covers, and another connecting it with Bhadrachalam and Warangal in neighbouring Telangana. I want Bastar to be connected with all major cities in India. On the lines of Ayodhya, we need an airport in Dantewada so that people can come here in huge numbers to visit the Danteshwari temple. The second issue is Naxalism. Be it at the hands of the police or Naxals, tribals are being killed. Young tribals are sent to jail or migrate. I tried to solve the issue when we were in power and succeeded. The (Bhupesh) Baghel government worked on the principle of ‘vishwas, vikas and suraksha (trust, development and security)’, but since the BJP has come to power, they have started killing and sending tribals to jail again… sai sai (quickly, a play on the name of BJP CM Vishnu Deo Sai). Tribals are being threatened. Since they are less educated, they are being beaten and threatened… We need to bring them into the mainstream. When we were in power, except the Silger incident, where three tribals were killed, no other incident occurred. There have been 10 incidents of police firing since the BJP took over four months ago. Today, even ordinary tribals going to the market or fairs are seen as Naxals by the government. I will fight this issue in Delhi and bring peace to Bastar. Tribals need to get land rights, food and water. The third issue is reduction of the height of the Polavaram dam on the Godavari river. This must be done to ensure villages in Chhattisgarh are not inundated and villagers are not displaced. We formulated the PESA, but after assuming power, the BJP is suppressing it and stealing the rights of tribals. We need it to save the Bailadila range and Nagarnar Steel Plant from Adani (Group). I have spoken about these issues in my 25-year career in Chhattisgarh and now I will take them to Delhi. In fact, I will also get a lead in Chote Amabal, where Prime Minister Narendra Modi has held rallies… The biggest fraud in the world today is electoral bonds… You have sent (former Jharkhand CM) Hemant Soren and (Delhi CM) Arvind Kejriwal to jail, but who will be sent to jail for this? When I was the state industries minister, I floated a proposal that the Chhattisgarh government will run the plant if the National Mineral Development Corporation (NMDC) cannot. I will fight till my last breath to ensure it is not privatised. I am 101% sure I will win… The BJP is saying it (the NDA) will win 400 Lok Sabha seats but I am not sure they will cross even 200. The Congress-led INDIA bloc will win and Rahul Gandhi will become the PM. This time, even the RSS is not with Modi, so how do you expect the country to support him? The STs and SCs are united this time and know neither the BSP or CPI will win. I am the BJP’s only competitor. People know I am a six-time MLA and former minister, and can raise their voice in Delhi. The BJP thinks it can get votes by using a car and a speaker but I am entering the hearts of people. We have worked for all communities. I come from a humble background and have worked my way up, hence people do not call me neta (leader), I am popular as ‘dadi (brother)’. Who knows the BJP’s candidate (Mahesh Kashyap)? The BJP gets votes only due to Modi, and this time there is no Modi wave. Look at him… he looks upset. He guaranteed Rs 15 lakh to each person but did not give even 15 paise. What guarantee is he talking about? Kashyap is the one making an issue out of it. The issues I mentioned earlier are the real ones. In India, we believe in all religions.    "," After the shock loss in the Assembly elections, the Congress is looking to revive its electoral fortunes in Chhattisgarh in the Lok Sabha polls. One of those two seats was Bastar, from where the Congress has fielded its six-term MLA Kawasi Lakhma this time, and which votes on April 19. He speaks to The Indian Express on the upcoming election, the poll issues, and rights of tribals, among other things. There should be two – one connecting the seven districts which the Lok Sabha seat covers, and another connecting it with Bhadrachalam and Warangal in neighbouring Telangana. On the lines of Ayodhya, we need an airport in Dantewada so that people can come here in huge numbers to visit the Danteshwari temple."
