Article_ID,Title,Title_link,Image,Date,Summary,Content,Field1
503,"As Gandhis stall on Amethi, Raebareli, voters warn: ‘Those times are gone when you could wave, win’",https://indianexpress.com/article/political-pulse/gandhis-stall-amethi-raebareli-voters-warn-times-change-9264309/,"https://images.indianexpress.com/2024/04/congress-amethi-1600.jpeg?resize=450,253","APRIL 12, 2024","As BJP's newly built offices buzz, Congress is struggling to keep up momentum, with coordination with SP still to take off","It is a Sunday afternoon. Sitting with two colleagues and scrolling through his social media feed, Amethi district Congress president Pradeep Singhal says he is confident Rahul Gandhi will again contest from the seat. And, five years after he lost the family seat to the BJP’s Smriti Irani, Singhal says: “He will win.” Barring the three, the district Congress committee office – more like a re-fashioned shop space – at Gauriganj in Amethi is empty. There is a larger central Congress office next to it, but it is deserted, just over a month before Amethi votes in the fifth phase, May 20. Singhal suddenly stops his social media scrolling as he chances upon the “massive turnout” for the nomination filing by a candidate in Banswara in Rajasthan. “Look at the crowd!” he exclaims. “He (the candidate) is on a camel.” His colleague Sarvesh Kumar Singh hesitatingly points out that the candidate Singhal mistook for the Congress nominee belongs to “some Adivasi party” (the Bharat Adivasi Party’s Rajkumar Roat). The two reluctantly return to the Amethi campaign. To questions as to why Rahul has not been declared the candidate yet, Singh says the announcement will come as soon as voting in Wayanad – the constituency in Kerala from where the Congress leader won in 2019 and is re-contesting – is over on April 26. But it is just a speculation, with no official reason on offer for the delay; the filing of nominations begins in a fortnight. Contrary to the listless Congress office, the BJP’s located a few kilometres away is buzzing – the party has built new structures in both Amethi and Raebareli. Irani, who has been re-fielded by the BJP, is scheduled to arrive the next day, her second visit to the constituency since the announcement of the election schedule. BJP district president Ram Prasad Mishra lists Irani’s “achievements” – the Amethi bypass project; a medical college in Tiloi; a trauma centre in Jagdishpur; a Coca-Cola subsidiary’s bottling plant. Above all, Mishra says, Irani is now “a resident of Amethi”. In February, she performed a house-warming ceremony for the house she has bought in Gauriganj. The BJP is underlining this, as well as the fact that Irani is also a voter from Amethi now – contrasting this to Rahul, who is contesting again from Wayanad. 2024 vs 2019 The 2024 battle in many ways has an echo of 2019. The Congress’s main pitch is still the Gandhi family and its “contributions” to Amethi, such as the Indira Gandhi Rashtriya Uran Akademi, Rajiv Gandhi National Aviation University, Rajiv Gandhi Institute of Petroleum Technology, and the Footwear Design and Development Institute. The BJP, in turn, blames them for the region’s “pre-2019” backwardness despite the seat’s VIP tag. Rahul won the seat thrice between 2004 and 2014, and before that it was held by Sonia Gandhi. Even Congress sympathisers say Rahul paid the price for not visiting Amethi enough, and then opting to contest from a second seat. There has been no visible course-correction, with Rahul visiting Amethi just four times in the last five years – in December 2021 and February 2022 to campaign for the 2022 Assembly elections, and in February this year, when his Bharat Jodo Nyay Yatra passed through the constituency and Raebareli. The 2022 Assembly results did not augur well for the Congress either. Of the five segments in Amethi, three were won by the BJP and two by the Samajwadi Party. Both the SP MLAs – Rakesh Pratap Singh (Gauriganj) and Maharaji Prajapati (Amethi) – are now in the BJP. The SP and Congress are allies this time, though as per SP leaders’ own admission, they have not held any coordination meetings so far. SP district president Ram Udit Yadav says their own preparations are on track. “We have been holding meetings from the booth to the district level.” On the SP leaders who joined the BJP, Yadav says: “The party has not suffered one bit, only emerged stronger.” A shopkeeper in Gauriganj, who remains a loyal Rahul voter, admits the Congress leader continues to let Amethi drift away. “Even if he doesn’t do much… an MP should be in the constituency often.” Another leader says: “Rahul, or for that matter any leader, can’t just file his nomination, wave at the people and vanish. Woh zamana chala gaya (Those times are gone).” The other seat In Raebareli, the BJP and Congress are almost in the same boat, waiting for their candidates. The stock reply of supporters is: “Let the candidates be announced. Phir pata chalega kaisi takkar hoti hai (Then we will know what kind of a fight it is).” However, unlike Amethi, there is a semblance of action at Tilak Bhawan, the Congress office in Raebareli, even at 7 pm on a Saturday – uncommon for the laid-back party. Sonia, who won the seat in 2019, has bowed out of the electoral race, and the buzz is that Priyanka Gandhi Vadra will make her electoral debut from Raebareli. While the Congress is yet to reveal its cards, a section of the BJP is apprehensive about the names that might fall out when the party opens its own. Two of those in contention are Dinesh Pratap Singh, a minister in the Uttar Pradesh government, who was the BJP’s candidate in 2019 and lost to Sonia by over 1.67 lakh votes; and Manoj Pandey, who recently crossed over from the SP. A section of the party believes only a candidate from “outside” – like Irani in Amethi — stands a chance against Priyanka. “The party will not be completely united if Singh or Pandey contests,” a leader says. Pandey’s exit though is set to hurt the SP-Congress alliance. In the 2022 Assembly elections, the SP had won all but one of the five Assembly segments falling under the Raebareli Lok Sabha seat, with the Congress drawing a blank. The only seat won by the BJP was the Raebareli Assembly segment. Here again, while the SP is confident of transferring its votes to the Congress, there have been no coordination meetings. “Akhilesh (Yadav) ji had a meeting and we were clearly told to ensure proper coordination with the Congress,” says Raebareli SP district president Virendra Yadav. At the Congress office, as a group of old-timers discuss politics, the talk veers around to Priyanka’s husband Robert Vadra, who has been making noises about wanting to contest. They rule out the possibility, asserting the candidate will be Priyanka. In his room, Congress city president Dheeraj Srivastava and a colleague are supervising feeding of data in a computer on booth agents. Asked whether he has been sounded out by the Congress regarding Priyanka, Srivastava says: “Bataya nahin gaya hai… par vishwas hai woh aayengi (We have not been told, but we are confident she will make her debut).” Compared to the faded Congress office, the BJP’s is in a newly built multi-storey building, a few kilometers away. And the keyboards are clicking fast here as well. Local BJP leader Pushpendra Singh is working out a schedule for mandal-level “nukkad sabhas (corner meetings)”, starting from Friday. Unlike in Amethi, where even Congress sympathisers struggle with Rahul’s “absence”, in Raebareli, voters say they understand, citing sitting MP Sonia’s fragile health. Since winning in 2019, her fourth victory in a row from Raebareli, Sonia has visited only once – a month after the results. The issues Both in Amethi and Raebareli, issues like the Ram Mandir at Ayodhya, the Opposition’s demand for a caste census or, for that matter, Rahul’s Yatra that crossed the region just two months ago are not top of mind. More common is the mention of “the use of ED and CBI” by the Modi government, though sarcastically in the context of leaders switching sides What comes up most often is the Centre’s popular free ration scheme. Is unemployment, one of the Congress’s main poll issues and part of its manifesto, a concern? For some it is. Standing outside a coaching institute with his friends, Satyendra Lodh, 18, elaborates the problem with asking the BJP questions. “BJP hamesha palatwar karti hai… Paani bharna hai toh balti leke kuen ke paas hi jayenge na? Kuan thodi na bolta hai taalab mein pani nahin hai. Sawal toh sarkar se hi poocha jata hai (The BJP is always ready with a counter. If one needs water, one will go to the well, isn’t it? The well can’t say, ‘But the pond has no water’. Questions can only be asked of the government).”    "," Sitting with two colleagues and scrolling through his social media feed, Amethi district Congress president Pradeep Singhal says he is confident Rahul Gandhi will again contest from the seat. And, five years after he lost the family seat to the BJP’s Smriti Irani, Singhal says: “He will win.” Barring the three, the district Congress committee office – more like a re-fashioned shop space – at Gauriganj in Amethi is empty. To questions as to why Rahul has not been declared the candidate yet, Singh says the announcement will come as soon as voting in Wayanad – the constituency in Kerala from where the Congress leader won in 2019 and is re-contesting – is over on April 26."
504,"In recent BJP turf Cooch Behar in Bengal, it’s Modi’s schemes vs Mamata’s",https://indianexpress.com/article/political-pulse/bengal-lok-sabha-elections-cooch-behar-mamata-modi-9263710/,"https://images.indianexpress.com/2024/04/cooch-behar.jpg?resize=450,253","APRIL 11, 2024","Sitting MP Nisith Pramanik constantly brings up Sandeshkhali, also appeals to Muslims; TMC's Jagadish Chandra Burma Basunia harks to steps taken by Mamata govt for Rajbongshis","There is a distinct similarity in the pitches of the Trinamool Congress (TMC) and the BJP as they campaign in North Bengal for the Lok Sabha elections. Prime Minister Narendra Modi and Bengal Chief Minister Mamata Banerjee made their stump speeches on April 4  and set the tone for the local representatives of the two parties as they make their final push in the three constituencies in the Dooars — Cooch Behar, Jalpaiguri, Alipurduar — which vote on April 19. The Cooch Behar fight is essentially between sitting BJP MP Nishith Pramanik and the TMC’s Jagadish Chandra Burma Basunia — who lost from Sitai in the 2021 Assembly polls. Nitish Chandra Roy of the Forward Bloc (FB) is also in the race, in a “friendly fight” with ally Congress’s Pia Roy Chowdhury. Barring Chowdhury, all three others are Rajbongshis. Since at least 2019, the BJP has held the upper hand in this region, and especially in this seat. That year, Pramanik won by over 50,000 votes. In the 2021 Assembly polls, the BJP won all the seven Assembly segments under the Cooch Behar Lok Sabha constituency. Basunia — whom Chief Minister Mamata Banerjee described as “our diamond candidate” at her April 4 public meeting — is banking on the promise of a hike in the CM’s direct benefit schemes like Lakshmir Bhandar. At around 2.30 pm on a Tuesday, the TMC’s Basunia, braving the blazing sun, tells the crowd gathered at the chaupal (community space) of Kalitala-Nayarhat village: “Do you want your Lakshmir Bhandar benefit to double from Rs 1,000 to Rs 2,000 (per month)?” The response is an emphatic “Yes.” Pramanik is reaching out to all, including Muslims, highlighting Prime Minister Narendra Modi’s development pitch and the recent series of incidents in Sandeshkhali. Addressing a meeting of around 200 people that same night, at a market in Kaljani in rural Cooch Behar, which is lit up compared to its surroundings, Pramanik, who happens to be the youngest minister in the Modi government, roars into a mic: “Modiji’s central schemes are for everyone — both Hindus and Muslims. Do you want a Sandeshkhali here?” The crowd responds, “No.” Pramanik’s campaign has been marked by small street-corner meetings with a convoy of cars, mobikes and an open-top jeep; Basunia has been holding meetings in villages accompanied by party workers and leaders. At Kaljani village, which has a significant Muslim population, Pramanik’s message is the same: “Modiji’s schemes — PM Kisan Samman Nidhi, PM Vishwakarma can be availed by all, Hindus or Muslims. We do not differentiate… I may be the candidate, but it is not about ‘I’. It’s about ‘we’. Let’s all strengthen Modiji’s hand, make India the world’s best nation.” He also steers to Sandeshkhali, asking the crowd whether they know about “the atrocities the TMC did on women there”. At Nilkuthi Bazar, he arrives as the Forward Bloc’s Roy is holding a rally. As Pramanik says he will wait for Roy to finish — “In a democracy, all political parties have the right to speak” — the crowd cheers. In his speeches, Basunia mentions the recent poll losses in Cooch Behar. At Kalitala-Nayarhat under Mathabhanga-II block, he admits the setbacks and adds: “This is the time to turn around… You all know and receive benefits of Mamata Banerjee’s schemes like Kanyashree and Lakshmir Bhandar… It is only Mamata Banerjee who has brought so many government schemes for you. Modi won’t do it.” In a rhetoric quite similar to Pramanik’s, Basunia adds: “We may be the candidates, but Didi (Mamata) is above us all. Vote for Didi.” Speaking to The Indian Express, Basunia says: “Last time, the Rajbongshis were with them (the BJP). This time, the community is with us. They have realised they will get nothing from the BJP or the Centre. At the PM’s April 4 address in Cooch Behar, there were no yellow Rajbongshi flags, unlike 2019. It is Mamata Banerjee who gave recognition to the Rajbongshi language, set up the Narayani battalion of the State Police for them, and erected statues of Rajbanshi icons (Panchanan Barma and Chila Ray).” On Sandeshkhali, Basunia says: “The culprits have been arrested by the state police. But what about the Manipur situation? What did the BJP and the Centre do?”    "," Prime Minister Narendra Modi and Bengal Chief Minister Mamata Banerjee made their stump speeches on April 4  and set the tone for the local representatives of the two parties as they make their final push in the three constituencies in the Dooars — Cooch Behar, Jalpaiguri, Alipurduar — which vote on April 19. Nitish Chandra Roy of the Forward Bloc (FB) is also in the race, in a “friendly fight” with ally Congress’s Pia Roy Chowdhury. Basunia — whom Chief Minister Mamata Banerjee described as “our diamond candidate” at her April 4 public meeting — is banking on the promise of a hike in the CM’s direct benefit schemes like Lakshmir Bhandar."
505,"Today in Politics: Last leg of Tamil Nadu campaign, Amit Shah in Madhya Pradesh, Maharashtra",https://indianexpress.com/article/political-pulse/amit-shah-maharashtra-madhya-pradesh-tamil-nadu-campaign-9263559/,"https://images.indianexpress.com/2024/04/amit-shah-3.jpg?resize=450,253","APRIL 11, 2024","Amit Shah will address his first election rally in Nanded, part of the Marathwada region, a former Congress bastion, where the NDA hopes to perform better","Union Home Minister Amit Shah’s campaign schedule on Thursday is packed with temple visits and rallies. He will first visit Mandla in Madhya Pradesh to perform a puja at the Maa Narmada Pujon Rapta ghat. After that, he will address a rally at the local police ground. Mandla will vote in Phase 1 of the Lok Sabha elections, scheduled for April 19, and the BJP’s Faggan Singh Kulaste will take on the Congress’ Omkar Singh Markaam here. In the afternoon, he will travel to Katni in Madhya Pradesh where he will go to the Vijaynath Dham mandir in the town. Katni falls under the Khajuraho Lok Sabha constituency from where the BJP’s VD Sharma is again contesting. The BJP had won 28 of the 29 seats in Madhya Pradesh last time, and it will be seen if it can manage to retain the tally in a state that falls into the Hindi heartland grouping that the BJP almost swept last time. Shah will also travel to Maharashtra, which has all the indications of being a neck-and-neck fight so far, with both the Maha Vikas Aghadi (Shiv Sena (UBT), Congress, NCP(Sharadchandra Pawar) as well as the ruling NDA (BJP, Shiv Sena NCP) vowing to go all out. The coming election is also the first major electoral contest after the respective splits in the Sena and the NCP. Shah will address a gathering in Nanded, his first election rally in Maharashtra. Nanded will vote in the second phase scheduled for April 26. Here, the BJP has fielded sitting MP Prataprao Chikhlikar as its candidate, while the Congress party’s former MLA Vasantrao Yashwant is in the fray. The Nanded Lok Sabha seat is among the eight constituencies in Marathwada region — a region that has remained a challenge for the BJP. Despite many efforts, the BJP has not been able to make deep inroads in Nanded. Even during the Narendra Modi wave in 2014, Ashok Chavan had defeated BJP candidate Digambar Patil. But this time, the BJP hopes to reverse the trend. In February, the BJP got Congress leader and former chief minister Ashok Chavan to join the party. This was a huge setback to the Congress with Chavan having a huge base in Marathwada. In the 2019 Lok Sabha elections, Chavan, who had then contested as Congress candidate, was defeated by BJP’s Prataprao Chikhlikar. The BJP is also taking heart from the loss of the Congress hold in the region, which is now limited to the districts of Latur and Nanded. In 2019, out of the eight seats, the Shiv Sena won three while the BJP won four. The AIMIM was a surprise winner in the lone seat of Chhatrapati Samabhajinagar. In a changed political scenario after the split in the Shiv Sena, the task in front of Shiv Sena *UBT)’s Uddhav Thackeray will be to retain his dominance. Meanwhile, Raj Thakeray, the president of the Maharashtra Navnirman Sena (MNS) is set to canvas in support of the NDA. Sanjay Shirsat, the spokesperson for the Shiv Sena made the announcement on Wednesday. “There was a possibility of vote division which could have resulted in us (NDA alliance) slightly missing our target to win 45 plus seats in Maharashtra. Now, we will definitely achieve our target,” Shirsat told reporters. All of the 39 seats in Tamil Nadu head for polls in the first phase, which is just a week away from now. The state will be closely watched in the days to come for the discourse shaping up. The ruling DMK and its allies had won 38 of the 39 seats in the 2019 polls and this time, the BJP hopes to make a breakthrough in the state. P Vaidyanathan Iyer writes that the BJP is hoping to cement caste identity – by reaching out to OBC groups such as the Vanniyars — alongside religious identity in the state. Whether that will pay off in Tamil Nadu, where the DMK is a formidable challenge and the BJP has never historically had a presence, remains unclear at the moment. Recommended reading: In Tamil Nadu, BJP rides on stormy petrel Annamalai in bid to disrupt Dravidian play It’s Kanimozhi all the way – through Ramanathapuram to Thoothukudi Meanwhile, BJP president JP Nadda will address a rally in Port Blair. The lone Lok Sabha seat of the Andaman and Nicobar Islands will go to the polls in the first phase on April 19. The BJP’s Bishnu Pada Ray is in the fray and will fight incumbent Congress MP Kuldeep Rai Sharma. Ray and Sharma have long been rivals in the seat. Ray was first elected to the Lok Sabha from the constituency in 1999 when he defeated Sharma. He again won in 2009 and 2014. In the 2019 elections, the BJP had fielded Vishal Jolly, and Sharma had defeated Jolly by a slender margin of 1,407 votes. —With PTI inputs    "," Mandla will vote in Phase 1 of the Lok Sabha elections, scheduled for April 19, and the BJP’s Faggan Singh Kulaste will take on the Congress’ Omkar Singh Markaam here. The BJP had won 28 of the 29 seats in Madhya Pradesh last time, and it will be seen if it can manage to retain the tally in a state that falls into the Hindi heartland grouping that the BJP almost swept last time. Shah will also travel to Maharashtra, which has all the indications of being a neck-and-neck fight so far, with both the Maha Vikas Aghadi (Shiv Sena (UBT), Congress, NCP(Sharadchandra Pawar) as well as the ruling NDA (BJP, Shiv Sena NCP) vowing to go all out."
506,Newsmaker | Child labourer to rexine bigwig to Kejriwal associate: The AAP minister who resigned,https://indianexpress.com/article/political-pulse/delhi-minister-raaj-kumar-anand-kejriwal-associate-9263456/,"https://images.indianexpress.com/2024/04/Raaj-Kumar-Anand-3.jpg?resize=450,253","APRIL 11, 2024","Raaj Kumar Anand, whose ties with AAP go back to India Against Corruption movement, came under ED scanner last November","Delhi Cabinet Minister Raaj Kumar Anand whose resignation from the Aam Aadmi Party’s (AAP) primary membership on Wednesday stumped his colleagues has been an associate of Chief Minister Arvind Kejriwal since the days of the “India Against Corruption” movement. “I was feeling suffocated for some time … till yesterday, it felt as if we (the AAP) were being falsely implicated but the (Delhi) High Court’s decision yesterday made me realise that there was certainly something wrong somewhere … I entered politics when Arvind Kejriwal ji said that if its politics changes, the country will change. But today, I say with much regret, that politics did not change but political leaders did,” Anand, who came under the Enforcement Directorate (ED) scanner last November, said after resigning from the party alleging corruption. From working as a child labourer in a padlock factory Anand went on to become one of the top rexine leather manufacturers in north India. According to party insiders, he was initially not as interested in politics as his wife Veena who contested on an AAP ticket in the 2013 Delhi Assembly polls from Patel Nagar and won. Two years later, when Veena was denied a ticket, a rift occurred between Anand and the party. She contested from Patel Nagar on a Swaraj Party ticket but lost to the AAP. “Anand is a businessman and has never been a ground worker or had keen interests like other politicians,” said a senior AAP leader. “But his wife was more interested and associated with the party than him but he always wanted to become MLA … when the rift mended and he came in contact with CM Arvind Kejriwal, he was given a ticket from Patel Nagar and won (in 2020).” Apart from the rexine business, Anand has also had business interests in the real estate sector. In the 2020 poll affidavit, he declared assets worth Rs 78.9 crore. Before joining the AAP, he used to run the Anand Path Foundation for underprivileged children. As part of this foundation, he also ran an “Ambedkar Pathshala”, according to those who know him. After Rajendra Pal Gautam resigned from the Delhi government in October 2022 amid a political storm over his involvement in a religious conversion event, Anand replaced him. Last November, the ED conducted searches at places, including Anand’s premises, alleging that evidence of unaccounted business investments and hawala payments sent to China in 2023 were recovered from some of his key employees. About Anand’s resignation, an AAP insider said, “He got scared very much and was in trouble after the ED’s raid at his house … He even discussed with some of the party leaders about this and how he was getting calls …He even lost 7-8 kgs and was sick for some time.” Adding that Anand’s resignation had created a tense situation in the party, the leader said, “His case is also different, so not many know what the exact case is … One of his close family members said they came in contact with some senior BJP leader last week.”    "," Delhi Cabinet Minister Raaj Kumar Anand whose resignation from the Aam Aadmi Party’s (AAP) primary membership on Wednesday stumped his colleagues has been an associate of Chief Minister Arvind Kejriwal since the days of the “India Against Corruption” movement. “I was feeling suffocated for some time … till yesterday, it felt as if we (the AAP) were being falsely implicated but the (Delhi) High Court’s decision yesterday made me realise that there was certainly something wrong somewhere … I entered politics when Arvind Kejriwal ji said that if its politics changes, the country will change. But today, I say with much regret, that politics did not change but political leaders did,” Anand, who came under the Enforcement Directorate (ED) scanner last November, said after resigning from the party alleging corruption."
