Article_ID,Title,Title_link,Image,Date,Summary,Content,Field1
507,"Blending caste with faith, BJP tries to open a space in Tamil Nadu",https://indianexpress.com/article/political-pulse/tamil-nadu-caste-faith-bjp-lok-sabha-elections-9263472/,"https://images.indianexpress.com/2024/04/P1-MODI-4col.jpg?resize=450,253","APRIL 11, 2024","S Ramadoss-led PMK, which represents the Vanniyars and demands reservation for them, has allied with the BJP. Whether the outreach to the middle castes will help BJP, or be counter-productive given the distinct social reform movement in Tamil Nadu, is a difficult question to answer.","Jothi Pandian and Shiva Kumar, two young men who run a small office a couple of kilometres from the Saint Gobain glass factory, off the Chennai-Sriperumbudur highway, couldn’t agree if sitting Lok Sabha MP and DMK candidate DM Kathir Anand would retain his seat in Vellore, a neighbouring constituency. Kathir Anand, 49, is the son of Tamil Nadu Water Resources Minister Durai Murugan, a DMK veteran, who entered the state Assembly in 1971, and is a 10-time MLA. But this time, Kathir faces a tough battle and there are many factors at play – a big one being Prime Minister Narendra Modi and how his combative nominee and state BJP president K Annamalai has changed the party’s image in the state. The BJP and its pronounced presence in the state is not lost on Jothi Pandian. “We are Vanniyars and our vote is for the Pattali Makkal Katchi (symbol: mango), which has tied up with BJP… What I personally believe is for us Vanniyars to prosper, Hindu religion has to survive and thrive,” he says, placing his community in the rubric of religion. It is not the first time that the S Ramadoss-led PMK, which represents the Vanniyars and demands reservation for them, has allied with the BJP; in the 2019 Lok Sabha and 2021 Assembly elections too, it was in an AIADMK-led alliance with the BJP. Vanniyars have a significant presence in north Tamil Nadu in parliamentary constituencies such as Vellore, Arakkonam, Krishnagiri, Dharmapuri and Tiruvannamalai. Jothi Pandian’s understanding of society structures, and his locating of the Vanniyar caste within the Hindu fold may appear quite simple at one level. But such social engineering that BJP is seen to be attempting in Tamil Nadu, the last frontier for the party which is perceived by many in the state as anti-Tamil and anti-minorities, requires remarkable understanding of the Tamil culture, society and history. The cementing of caste identity with religious identity and riding two horses at the same time is viewed as a key BJP strategy in Tamil Nadu. Not doing so risks the BJP being captive to its image of being a ‘pro-Brahmin’, upper caste-dominated party. But whether this outreach to the middle castes will help it, or be counter-productive given the distinct social reform movement in the state, is a difficult question to answer. The BJP has been trying to find space in Tamil Nadu ever since the demise of AIADMK’s star leader J Jayalalitha, who eventually inherited the political legacy of MG Ramachandran. Indeed, none of the Dravidian parties have in the past offered support to the BJP’s core Hindutva ideology – it was always tactical, says Ramu Manivannan, an academician, who has worked in Delhi University for almost 15 years, and was head of the department of politics in Madras University. “The decline of Congress over the last decade, transition in political leadership in Dravidian parties here – BJP foresaw all this. It systematically started preparing for many years now,” he said. In the absence of an alliance with AIADMK, the three-way split in the MGR-founded party – Edappadi Palaniswami, O Panneerselvam and TTV Dhinakaran (Amma Makkal Munnetra Kazhagam, a BJP ally now) – definitely doesn’t hurt the BJP. “There is a vacuum in Tamil Nadu.. which BJP sees. But it has underestimated the resistance offered by the civil society,” he said. Having said that, Manivannan agrees that caste continues to play a dominant role in voting behaviour. “The Dravidian social reform movement is one of its kind, laudatory and has served the people well. The flip side is, everything gets tucked under the carpet. A lot of things, especially accountability, get buried,” he said. This is where spaces open up for Modi to exploit — as he did in Vellore on Wednesday. “DMK has the first copyright on corruption,” Modi alleged, and claimed that thousands of crores of rupees sent by the Centre gets consumed by DMK’s corruption. What also helps the BJP on the ground is the work silently undertaken by the Rashtriya Swayamsevak Sangh cadre. Over the last five years, the number of RSS shakhas in the state have almost doubled to 2,400, say sources in the RSS. MP Mariappan, a Dalit RSS worker, who travelled 40 km to Vellore Kottai (fort) from Varadhareddipalli panchayat in the district, to attend Modi’s rally on Wednesday morning, said, “We are not in the forefront. We work quietly behind the scenes.” The traditional voting pattern of Dalits is changing, Mariappan claimed. “Earlier, SC votes in my panchayat went only to the DMK. Now, 600 out of 1,140 Dalit votes in my panchayat are for the BJP.” He speaks Hindi quite fluently and has worked in Saharanpur in Uttar Pradesh and Dehradun in Uttarakhand. Indeed, for any party to win, SC votes are critical. As per the 2011 Census, the Scheduled Caste or Dalits accounted for 21.85 per cent of Vellore district’s population. While Varadhareddipalli panchayat may not be representative of other villages; it, however, suggests possibilities for the BJP. Attacking the DMK, Modi said the party has become a “one family company” – a theme that he uses to club the DMK and its key ally Congress in the same bracket. “To contest from DMK, you need to have these three criteria: family politics, corruption, anti-Tamil culture. DMK has trapped its youth in old politics; hence, the TN youth is unable to step forward,” he said, canvassing for BJP and its alliance partners in north Tamil Nadu. In Vellore, AC Shanmugam, who has a large education business, was originally with the AIADMK, and later founded the New Justice Party, is the BJP candidate. A Mudaliar by caste, he had contested the 2019 Lok Sabha elections and polled 4,77,199 votes, but lost to DMK’s Kathir Anand by a narrow margin of 8,141 votes. The constituency has a strong presence of Vanniyars, Mudaliars and Muslims. Muslims accounted for 10.54 per cent, and Christians 2.82 per cent, of the population in Vellore district, according to the 2011 Census. Together with Dalits, they made up 35.21 per cent of Vellore district’s population in 2011. While Vanniyars are said to account for a large percentage of the population in north Tamil Nadu districts, there are no reliable estimates of the size of the community in the absence of a caste census. So is the case with other big communities such as Mudaliars. But, the Tamil Nadu government had previously tried to provide 10.5 per cent special internal reservation to Vanniyars within the 20 per cent quota for Most Backward Communities; this was quashed by the Supreme Court in March 2022. Muslim voters, who are in large numbers in Vaniyambadi and Ambur Assembly constituencies within the Vellore parliamentary seat, believe Kathir Anand will win. Their votes, they said, will go to the strongest candidate against the BJP. A Congress leader, who did not wish to be named, however, said Kathir Anand faces considerable anti-incumbency. An uphill task lies ahead for him, the leader said, adding that votes will be largely for the party, not necessarily the candidate. The party is also counting on SC votes. In 2019, while the elections were scheduled to be held on April 18, they were rescinded by the President after the Election Commission reported use of money power to influence voters. The Income-Tax department had recovered huge cash from an alleged associate of Durai Murugan, father of Kathir Anand, who was in the fray. Polling was then held on August 5, 2019, the day Article 370, was abrogated. In his public address, Modi sought votes for the NDA candidates in other north Tamil Nadu constituencies including Sowmiya Anbumani, daughter-in-law of PMK founder Ramadoss, and wife of Anbumani Ramadoss, who has been fielded from Dharmapuri; K Balu of PMK who is pitted against DMK’s S Jagathrakshakan, the sitting MP; and K Asuvathaman who is contesting from Thiruvannamalai.    "," Jothi Pandian and Shiva Kumar, two young men who run a small office a couple of kilometres from the Saint Gobain glass factory, off the Chennai-Sriperumbudur highway, couldn’t agree if sitting Lok Sabha MP and DMK candidate DM Kathir Anand would retain his seat in Vellore, a neighbouring constituency. But this time, Kathir faces a tough battle and there are many factors at play – a big one being Prime Minister Narendra Modi and how his combative nominee and state BJP president K Annamalai has changed the party’s image in the state. “We are Vanniyars and our vote is for the Pattali Makkal Katchi (symbol: mango), which has tied up with BJP… What I personally believe is for us Vanniyars to prosper, Hindu religion has to survive and thrive,” he says, placing his community in the rubric of religion."
508,"Jobs and tourism to selfies and Ganga aarti: With message of hope, Baluni hits the campaign trail in Pauri Garhwal",https://indianexpress.com/article/political-pulse/jobs-tourism-to-selfies-ganga-aarti-with-message-of-hope-baluni-hits-the-campaign-trail-9263358/,"https://images.indianexpress.com/2024/04/BJP-candidate-Anil-Baluni-with-supporters-on-the-banks-of-the-Ganga-at-Devprayag-Sangam-in-Uttarakhand.-Avaneesh-Mishra.jpg?resize=450,253","APRIL 11, 2024","Baluni, who serves as the national chief spokesperson for the BJP, was selected as the party’s Rajya Sabha candidate from Uttarakhand in 2018.","The narrow lanes of Pauri Garhwal are far away from his office in the BJP headquarters on Delhi’s Deen Dayal Upadhyaya Marg as the party’s national media head but Anil Baluni says that’s hardly a distance. “I bring the message of hope,” he says, “I see that hope reflected in the eyes of everyone. That a victory here is a victory for local and regional development and is also a significant part of the national effort to ensure a third term for Prime Minister Narendra Modi.” With religious sites like Kedarnath and Badrinath, landmarks such as Jim Corbett National Park, and areas impacted by critical issues like Joshimath under its jurisdiction, the importance of Uttarakhand’s Garhwal defines the campaign of Baluni, who is fighting his first Lok Sabha polls from the constituency. Elections here are on April 19. At 9 am on a Sunday, after a traditional breakfast, he sets off on the campaign trail — in a white kurta-pyjama, a blue jacket, a saffron scarf featuring the lotus, and canvas shoes. The day’s itinerary entails a visit to the Ghantakarna Devta temple in the morning and a Ganga aarti at Devprayag Sangam in the evening. Additionally, his campaign team has identified 18 stops, including numerous public gatherings and “nukkad sabhas” (street corner meetings). “Campaign in the hills is very  different. Villages here are in the interiors. The people love us, which is why they came to the roads. We share our greetings and move to the next destination. We do this at 25-30 spots in a day on average. The plan is to cover around 300 km every day,” Baluni tells The Indian Express as his cavalcade makes a brief halt. He gets down from his vehicle and greets a group of women holding BJP flags and raising slogans of “Aa gayi Bhajapa, chha gayi Bhajapa” and “Anil Baluni zindabad.” After clicking selfies with them, he seeks their permission to leave and resumes his journey to the temple. “During campaigning, we can’t spend the night at the same place we started our day. Even the meals are not decided. I have a breakfast of roti-sabzi or paratha-dahi. I carry some fruits in my car, and for lunch, we generally get dal-bhat (rice and lentils) prepared by supporters. Then there is a cup of evening tea, if there is time, and a simple dinner at whichever hotel I am staying in,” says Baluni. “The temperature fluctuation also has its challenges. If I am in Kedarnath Vidhan Sabha, the temperature will be around 10 degrees. But suddenly if I go to Kotdwar, the temperature increases threefold. All of this causes throat infection so I gargle with hot water and take steam every day,” he says. Baluni, who serves as the national chief spokesperson for the BJP, was selected as the party’s Rajya Sabha candidate from Uttarakhand in 2018. The last time he contested an election was in 2005, when the Supreme Court ruled the cancellation of his nomination from the Kotdwar Assembly seat in 2002 as unjust. Subsequently, by-elections were conducted in 2005, which he lost. Baluni says the current campaign is different in the sense that he is now the BJP media head, and thus much more experienced and with a better understanding of how an election campaign works. A team from Delhi keeps him updated on major social media developments related to his campaign. At the same time, he continues his duties as the national media in-charge, keeping a tab on updates from across the country. Around 4 pm, as his cavalcade reaches Maletha area, a meal is prepared by local BJP MLA Vinod Kandari at his office there. Half an hour later, the journey resumes. Addressing a gathering of 50-60 people in the Kirti Nagar area, Baluni promises that the whole of Uttarakhand will be developed in Modi’s third term — from people migrating back to the state to employment for every household. He says the new Rishikesh-Karanprayag railway line will transform the area and bring a surge in tourism. From vaccines for all at the height of the pandemic and free ration to over 80 crore individuals, Ayushman cards, implementation of Kisan Samman Nidhi, and allocation of housing to 4 crore people, Baluni says the work of the Centre finds an echo in each home in the state. “People recognise that this election is about choosing the Prime Minister, making it a vote for Narendra Modi… Looking ahead, our agenda focuses on ‘developed India, developed Uttarakhand, and developed Garhwal’. We are committed to developing destinations, curbing migration, and ensuring employment opportunities in every household, with tourism serving as the primary driver,” he says. He also takes on the Congress for questioning the valour and bravery of the country’s first Chief of Defence Staff, the late General Bipin Rawat. Baluni is up against Congress’s former state president Ganesh Godiyal, a two-time MLA from the Thalisain seat (removed in 2012 following the delimitation) and Srinagar constituency. Godiyal had lost the 2022 election from the Srinagar seat to BJP’s Dhan Singh Rawat, with a narrow margin of 587 votes. The Garhwal Lok Sabha constituency comprises 14 Vidhan Sabha segments — Badrinath, Tharali, Karnaprayag, Kedarnath, Rudraprayag, Devprayag, Narendranagar, Yamkeshwar, Pauri, Srinagar, Chavbattakhal, Lansdowne, Kotdwar, and Ramnagar. These segments fall within five districts — Chamoli, Rudraprayag, Tehri Garhwal, Pauri Garhwal, and Nainital. In the 2022 Vidhan Sabha elections, the BJP emerged victorious in 13 of these Vidhan Sabha seats, leaving Badrinath as the sole assembly seat held by the Congress. However, the incumbent Congress MLA Rajendra Singh Bhandari recently defected to the BJP. In 2014, the seat was won by senior BJP leader and former Uttarakhand chief minister Major General (Retd) Bhuwan Chandra Khanduri, who defeated senior Congress leader Harak Singh Rawat. In 2019, former Uttarakhand Chief Minister Tirath Singh Rawat secured the seat for the BJP after defeating Congress’s Manish Khanduri, who recently joined the BJP. Around 7.30 pm, Baluni reaches the Devprayag Sangam, where the Alaknanda and Bhagirathi rivers converge to form Ganga, for the evening aarti. “I started the campaign from Ghantakarna Devta temple and ended at the Devprayag Ganga aarti. The day could not have been any better,” he says. Back at the hotel, Baluni says, they will discuss all that happened during the day, the response they received, what the Opposition did, and plan for the next day. On several occasions in the recent past, including his rally this month in Uttarakhand’s Rudrapur and his visit to Kedarnath in 2022, Prime Minister Narendra Modi has said that the current decade will be the “Decade of Uttarakhand”. “Today Uttarakhand has all kinds of modern connectivity. The BJP has given 85,000 houses to the poor, water connection to 12 lakh houses, over 5.5 lakh toilets, free gas connection to 5 lakh women, property cards to 3 lakh people under the Swamitva Yojna, and opened bank accounts for 35 lakh people in the state. The BJP has directly deposited Rs 2,200 crore in the bank accounts of small farmers of Uttarakhand… When your intentions are right, things work out like this,” the PM said in a recent speech in Rudrapur. These words will find an echo in Baluni’s campaign as he moves to the next stop.    "," That a victory here is a victory for local and regional development and is also a significant part of the national effort to ensure a third term for Prime Minister Narendra Modi.” With religious sites like Kedarnath and Badrinath, landmarks such as Jim Corbett National Park, and areas impacted by critical issues like Joshimath under its jurisdiction, the importance of Uttarakhand’s Garhwal defines the campaign of Baluni, who is fighting his first Lok Sabha polls from the constituency. Additionally, his campaign team has identified 18 stops, including numerous public gatherings and “nukkad sabhas” (street corner meetings). The plan is to cover around 300 km every day,” Baluni tells The Indian Express as his cavalcade makes a brief halt."
509,"Why BJP has dropped Kirron Kher in Chandigarh, opted for a local face",https://indianexpress.com/article/political-pulse/bjp-dropped-kirron-kher-in-chandigarh-sanjay-tandon-9262980/,"https://images.indianexpress.com/2024/04/Untitled-2024-04-10T210504.337.jpeg?resize=450,253","APRIL 11, 2024",Sanjay Tandon who replaces the actor-politician for the Lok Sabha polls is Chandigarh BJP’s longest-serving president. His father Balram Das Tandon was former Punjab Deputy CM,"For the Chandigarh Lok Sabha seat, the BJP on Wednesday replaced two-time sitting MP Kirron Kher with Sanjay Tandon, a former Chandigarh BJP chief and the son of former Punjab Deputy CM Balram Das Tandon. Here are the reasons why the party preferred a new candidate over the incumbent MP. Ten years into her Lok Sabha tenure, Kirron Kher has failed to get rid of the “outsider” tag. Only last month, the actor-politician said, “I left my family and profession to live and work in Chandigarh for the past 10 years”. But senior BJP leaders insisted that a local candidate should be preferred. Kher’s name was missing from the list of four names the local selection committee sent to the central leadership, citing that people in Chandigarh need “a local candidate” this time. The December 2021 civic polls in Chandigarh, in which debutant AAP won a majority, were an eye-opener for the BJP. While the AAP got 14 councillors in the general house of the Chandigarh Municipal Corporation, the BJP tally came down from 20 seats in 2016 to 12. Sanjay Tandon is the longest-serving president of Chandigarh BJP, holding the post from 2010 till 2019. It was during Tandon’s stint that the party won the Lok Sabha polls back-to-back as well as the Chandigarh civic elections. After this success, Tandon became the co-in-charge of Himachal Pradesh BJP. Tandon’s father Balram Das Tandon, a lifelong RSS worker, was the Punjab deputy CM from 1969 to 1970 and later the Governor of Chhattisgarh between 2014 and 2018. The Congress’s Pawan Bansal won Chandigarh three straight times starting in 1999. In 2014, the BJP fielded Kher in what was her debut election. Asked about her tenure, Federation of Sector Welfare Associations of Chandigarh chairperson Baljinder Singh Bittu told The Indian Express, “None of the city’s outstanding issues has been resolved. Traders are suffering, and so are residents of housing boards… She did nothing and spent her MPLAD budget on insignificant civic works. It is different when a local candidate is your MP.” He alleged there was no significant work done in the last 10 years. Bittu also spoke of Kher’s alleged unavailability, contradicting her claim. “People couldn’t meet her. She was hardly there in Chandigarh. Had she been repeated this time, people wouldn’t have voted for her… They wanted a local candidate,” he said. After the fiasco during the Chandigarh mayoral polls in February in which presiding officer Anil Masih was caught on security cameras invalidating votes of AAP and Congress councillors to give the BJP a win — it was overturned with a stern rebuke by the Supreme Court — the party is desperate to repair the damage. The controversy, just a month before the Lok Sabha polls were announced, has greatly dented the party’s image. A candidate change deflects some of the negativity surrounding the party at the moment. Down the years, Tandon’s accessibility and visibility in Chandigarh played a big part in the ticket going to him. On the other hand, despite Kher having prepared for an honourable exit by announcing she was keeping unwell, there was an undercurrent of anti-incumbency against her. Local BJP leaders concede that Kher got a second chance in 2019 only “due to a Modi wave”. “If Kher got another chance, it was due to the Modi wave. When PM Modi addressed a rally here in 2019, he only told people to vote for him… He didn’t mention Kher even once,” said a senior BJP leader in the Union Territory.    "," For the Chandigarh Lok Sabha seat, the BJP on Wednesday replaced two-time sitting MP Kirron Kher with Sanjay Tandon, a former Chandigarh BJP chief and the son of former Punjab Deputy CM Balram Das Tandon. Only last month, the actor-politician said, “I left my family and profession to live and work in Chandigarh for the past 10 years”. Kher’s name was missing from the list of four names the local selection committee sent to the central leadership, citing that people in Chandigarh need “a local candidate” this time. Asked about her tenure, Federation of Sector Welfare Associations of Chandigarh chairperson Baljinder Singh Bittu told The Indian Express, “None of the city’s outstanding issues has been resolved."
